,text,task1
1875,so i got back from work and i had two things in my left hand when i got out of the car my keys and something i wan,NOT
1876,shit hard,HOF
1877,or lying to find an excuse for his own failures they have no excuse to violate international law,NOT
1878, lmaooo zendaya said ill one up you tom i fucking love her,HOF
1879, the way yoongi gets stuck after launching himself into the bounce house but walks away as if nothing happened is the re,NOT
1880, fuck sex can you stick around and not give up on me,HOF
1881, tap water phuthadithjaba may ,NOT
1882, if you the government were putting your finger on the scale would you intentionaly make your illegal activity public,NOT
1883,it pains me so much that this idiot nonentity vagabond asshole piece of shit is from m,HOF
1884,you are basically fucked were at the restaurant we have all come to this will happen,HOF
1885,fuck,HOF
1886, seth curry on altercation with will bartonhe waited for a few people to get in between us and when a few people were in be,NOT
1887, ben shapiro an enabler of fascism he is jewishyet another example of the utter everyone is a nazi hysteria that has,HOF
1888,they gone kill kawhi he dead ass tired,HOF
1889, ah shit here we go again,HOF
1890,i can get behind this,NOT
1891, for the rest of this weekend everything in my shop is  off 5101951219,NOT
1892, just saw thisholy fuck my sides lol,HOF
1893,not sure if the card got replaced but i have a key card again apparently the lock battery needs to be changed ev,NOT
1894, drogon flew off with danys corpse so jon had to have confessed to murdering her bro sit yo honorable ass down sometim,NOT
1895, me so is are such idiotssomeone else so is are a bunch of idiotsme,HOF
1896, boris is a racist thug with little concern for anyone except himselfdo not be like boris,NOT
1897, bran you literally see the past present and future why do you need a master of whisperers,NOT
1898, finally some good fucking food part  the dessert is a warm glaze  gtgt ltlt,HOF
1899, so you are perfectly fine with a babies brains being sucked out of their head why not paint that and be super p,HOF
1900,here we go again,NOT
1901, another acoustic masterpiece that were left in the dust we need the rest of these amazing songs https,NOT
1902, a reminder to get yo ass outside,HOF
1903,orrrrrr you can come visit and we can go to the beach,NOT
1904,what the fuck do i have short term memory loss for,HOF
1905,truly a fucking idiot,HOF
1906,bro my power is still fucking out,HOF
1907,yo fucking angola nacho head ass,HOF
1908,another hour it is may  at 00pm,NOT
1909,bull shit,HOF
1910,oryttt here we go,NOT
1911,btsanalytics final bts btstwt vote minutes left tweetrtreply below,NOT
1912, graham is reading random portions of transcripts and just said trump is a fucking idiot then he looks up and says ,HOF
1913, hang in there armys just bear a little more time okay okayits okay to rest you deserved it bts,NOT
1914,the problem with wanting more is that the second you get it it can be always taken away,NOT
1915, i would rather never see a whale in my entire existence on this earth than to see it in a small tank,NOT
1916,acceptable compliments calling me cute tiny pretty etcbad compliments i want to fuck you please be mine do you like my cock baby,HOF
1917,dumbass no clue regarding government just daddies pet,HOF
1918,  conference  may    sheraton universal in los angeles3 days speakers incredible pan,NOT
1919, three months ago attempted to throw manuel oliver the father of parkland victim joaquin out of a gun violenc,NOT
1920,coming in to the tribunal natural and unbothered is a whole mood,NOT
1921,huhfacts not bullshit that would be trump,HOF
1922, steve rogers assamerica,HOF
1923, i want to suck the nut of him,HOF
1924,you are not going to get ruby,NOT
1925,if you need to exams for those languages to go to the places you want there is some cool apps to learn,NOT
1926,ooo bro you got a reply on this go get it get it get it get it follow yo dreams boy,NOT
1927,its my birthday tomorrow come liverpool just give me an early birthday present plzz,NOT
1928,fuck choking i am tryna get murdered,HOF
1929,god dammit help bitch,HOF
1930,i cannot figure out why anyone would trust the loser that lost over a billion dollars,HOF
1931,i fucking hate whitewash fuck you,HOF
1932, i do not think about my father grandmother or greatgrandfather as much as mr narendra modiwhy would anyone holiday,NOT
1933, over billion people in this world and you think i am going to chase someone who does not even want me hahahthats exactly what,NOT
1934, months today payooo the laughter and punches gone  just like that you live in words and in our memo,NOT
1935, jdnsjsnsnsjsn i finally finished this after a few weeks and i am fucking loving it aaaaaaaaaaaaaaaaa https,HOF
1936,shame about the world ending init,NOT
1937,you are welcome,NOT
1938,i am so eleldllwlrlwkrkks i fucking love them,HOF
1939, were aware you are strong jungkook no need for this,NOT
1940,fuck red vines,HOF
1941,in a world full of lies my only truth is you here is a letter from me to you,NOT
1942,i think you are on to something here,NOT
1943, what i learn from everything is the lesser you know about something the better you do not need to know what people say,NOT
1944, people calling characters  cm in height as shortmy cm gremlin ass,NOT
1945, please do not rt lindsey graham saying trump is a fucking idiot on national tv today it will only upset,HOF
1946,your sooo fucking dumass why the pump fortnite is so shit,HOF
1947,aight bruhbe downloading ina minute,NOT
1948,south carolina folks are being played for fools by this tough ass coward lindseyget rid of him,HOF
1949,imagine being so dumb you actually need a sign to tell you not to be a bigot,HOF
1950,it is almost the weekend plz show me the pets you get to spend it with here is mine,NOT
1951, wow you are a fucking snitch,HOF
1952,truly sick,HOF
1953, you are lying if you are telling me you do not know the vegas vlog word for word,NOT
1954,damn it,HOF
1955,lol i just won bucks i bet my buddy that this moron magat could not r,HOF
1956, funny this almost like all this shit about equal rights from transphobes is a smokescreen and it is mostly about promot,HOF
1957,if you need find me on messenger or snapchat this abortion shit is getting out of my processing power,HOF
1958,fuck everybody,HOF
1959, can i just say that you should own up to that shit and fucking admit to ur mistakes and it will make you a better person thanks,HOF
1960,lmfao fuck you,HOF
1961,she could not help but giggled and playfully squirm in his grasp,NOT
1962, and here is my little monster chase he is not into the bikes as much as peyton but he is only so not quite sure yet but,NOT
1963, sexy doll star bella roze flashing her amazing ass while getting her pussy pounded she is mikasas bff so she is superhappy,HOF
1964, cris  look at me i am really sick dani,NOT
1965, the club owner is asking for communitys help to get the club where it needs to be so it can open again here is the gofundm,NOT
1966, no oneeer       i need to get  ,NOT
1967,glad i picked comfort food for dinner tonight roasted turkey breast and greens with ham hocks,HOF
1968,because it is an au by all means the names can be changed,NOT
1969, i went to high school with james charles he is a sexual predator and sexually assaulted my friend i am glad to see his,HOF
1970, bru this shit weird but look lit,HOF
1971,i hate my father bruh,HOF
1972, happy birthday to our nottwodaysoldanymore goth boy vthank you for everything you have done you can rest well now,NOT
1973, if i she would a tear for you then bih that means i care about yo ugly ass,HOF
1974,that is why i saved my card info on my amazon prime so i do not go through that exactly but that might be even worse,NOT
1975, dubstep lineups are getting so stacked where the headliner and the smaller names are just as good if not better do not be th,NOT
1976,after years i get off probation inna month bitch big gas slatt,HOF
1977, i been wanting to go do this forever like a date or sum lol this shit fun,HOF
1978,young people are becoming conservatives because they have been watching videos of sjws going ape shit,HOF
1979,you all seeing this shit,HOF
1980,she nodded and smiled a thousand words through a smile people say hans was stubborn foul means,HOF
1981, how the fuck he put my whole jacuzzi in a garbage bag,HOF
1982, i think,NOT
1983, so white people are scared of muslims till its time to go morocco or turkey for holiday ,NOT
1984,you are only one person vote,NOT
1985,that is so stupid,NOT
1986, bruh if you want to cheat or have the urge to fuck other people then just be single you dumb mf,HOF
1987, out of respect you just do not do certain shit,HOF
1988,sorry liberal ladies we love our brash masculine president you had your limp wristed spineless guy for years,NOT
1989, my grandmother rather than saying i am full would say i have had an elegant sufficiency this became a famil,NOT
1990,blocked tired of your bullshit,HOF
1991,fine ampyou,NOT
1992,i know i have used this gif quite a bit over the years its one of my favorites never has it been more applicable,NOT
1993,you ask for basic shit when you are dating to stand out but get tired of the basic shit after years of marriage a,HOF
1994,if he does not get what he wants hes not going to declare defeat and cancel the 120 billion of public debt owed hi,NOT
1995,idk why she is making it then,NOT
1996,thinking about this i hope zendaya gets back on this show now that she is not disney and put their asses on blast i,HOF
1997,ill beat its god damn fucking ass,HOF
1998, gaon digital chart weekly dance the night away  839026606 total 2,NOT
1999,you are an ignorant clown,HOF
2000, impeachment of  barr by and its spokesmen at  has never been about the conduct of the pr,NOT
2001, niggas will talk to and fuck anything any size any shape ugly or not do not ever feel flattered cuffing might be a dif,HOF
2002,me as fucking fuck,HOF
2003, muslim refugees in swedenthis is why we do not want them inunited states of america muslims only want to take over usa,HOF
2004,damn you really did scorpios dust,HOF
2005,bitch you too fym,HOF
2006,shaos ass in his  art is a dayum son lmao what ass he has a cloth tied around his waist it is billowing sligh,HOF
2007,what i have to say about the societygrizz deserves to be w samfuck off campbellnetflix just snapped it with t,HOF
2008,liar liar you should be fired but the president is a weenie and a meanie,HOF
2009, this james charles shit bitch is sick,HOF
2010, did you not fucking tell allstars to get paid,HOF
2011, trump is also s bit of a notorious flouter of constitutional obligations ethics rules and oaths of office oh well,NOT
2012,dates and prices listedgolden gates holiday centre3 bedrooms berth golden gate holiday centre towyn,NOT
2013,suck it xrider,NOT
2014, here is an article i wrote for about friend and musician dan pash and how he is still making music with less,NOT
2015, brienne should have been petty and wrote he died protecting the sister he was having sex with dirty ass,HOF
2016, you can do all that and even write embarrassingly stupid tweets like this just do not kill any humans and everything wil,NOT
2017, greatest president ever,NOT
2018, lol shut the fuck up,HOF
2019, while gop cut 15t in taxes for millionaires amp billionaires amp tried to ban muslims from immigrating to americaa muslim i,HOF
2020,he is a tory is not mates with cameron that ben voice is fucking whiney and he i,HOF
2021,fuck sucide and drink beer,HOF
2022,i do not think you should call yourself that not even as a joke sorry but you are too good for that,NOT
2023,humility is a strange thing the minute you think you have got it you have lost it sir edward hulse,NOT
2024,you are such an amazing artist,NOT
2025, bet ko talaga si dawn she does not have any filter but she speaks facts she is not bias and sees the situation in a rationa,NOT
2026, cold fucking slaw,HOF
2027,well the guy post a pic showing them off hes asking to get a comment like that,NOT
2028, you look like your soul is drained  please go get you some rest  i love you,HOF
2029,people found shelter from the sun at yesterday,NOT
2030,karma is a bitch messi messi messi,HOF
2031,i just basically signed my life away with documents for this damn house that is not even mine yet,NOT
2032,fuck,HOF
2033,  i have been listening carefully to my republican colleagues amp it seems they are going to coordinate a lock h,NOT
2034,omg shut the fuck up itsrally nobody cares about what you tweet,HOF
2035, brexit will improve your lives2019it will not be as bad as that time that of us fucking died,HOF
2036,been getting showers and gusty winds off and on for the past few days,NOT
2037,i think my earphones are alive it tangled itself complicatedly in such tangle that is not even plausible unless with the use of two hands,NOT
2038, she is beautyshe is graceshe will punch you in the face     bnha oc detailed as you d,NOT
2039, suck amp fuckleft or right,HOF
2040, my campaign for president was conclusively spied on nothing like this has ever happened in american politics a reall,NOT
2041, you are a staffing firm you put this ad up and you are a professional staffing consultancyso here is what hap,NOT
2042,if you are against abortion then do not abort let people do what the fuck they want you cannot stop them give up,HOF
2043,she is been nothing but nice and everybody is so fucking mean to her,HOF
2044,rolandscahill you think you guys are unsatisfied tonight after the game of thrones finalenow think how unsat,NOT
2045,i met some amazing ass people this school year i hate to see it all end,HOF
2046,damn feels bro,HOF
2047,i thought it was ok lot of wasted time at the end we get it aryas on the boat do not need shot,NOT
2048,a personal fuck you to anyone who has been inconsistent and has hurt the loml you all are not shit and i really cannot stand any of you,HOF
2049,full offense but people that make video games almost never understand what is enjoyable about video games,HOF
2050, this is so cute the9 fsnims editing skills be like gtgtgtgtgtgtgt,NOT
2051,when you invite jesus into your life he provides exactly what you need and who you need to walk it out,NOT
2052,not following this whole case but wtf is this ali zafar is such a small guy,HOF
2053, no shit,HOF
2054, how many retweets do i need to get for you to get me this hoodie,NOT
2055, rep jerry nadler i think there are great difficulties for the attorney general at this point besides the fact that he clea,NOT
2056,go uste,NOT
2057,who is in bed with russia we know you dems are evil hillary sold our uranium to th,HOF
2058, friendly ass,HOF
2059,are you a parentcarer of the school who works in joinery and can spare a little time to help us improve our outdoo,NOT
2060,you done lost his rabbit ass mind,HOF
2061, what the actual fuck,HOF
2062,but then i am christian so you thought oh she is just a christmas,NOT
2063,but you would miss out on the late night entertainment  i have booked some tickets already but will no doubt spend a fortune on more,NOT
2064, due to personal reasons i will not be giving a fuck ever again,HOF
2065,damn right i just want petey to come in with a flow so they can be the flow bros,NOT
2066, get to know them as a person before you shoot your shot go talk over lunch or something go out to the park make dinne,NOT
2067,staying away from toxic people who only want to use me when they are in need,NOT
2068, jk when i tell him hes not allowed a th banana milk,NOT
2069, these gay white rappers and pop stars get all this attention just to shit on indie artists of color and claim we got to wor,HOF
2070, saw this in a bathroom stall at a concert i went to tonight and its all i can think about,NOT
2071, here is what i do not understand why are people just ok with lying under oath,NOT
2072, i remember when trump took over america and people were wildin out like omg we are doooomed all i kept saying was,NOT
2073,lol fake as fuck,HOF
2074,a few hours ago i saw this image and it waz grey and blue now it is pink and white the fuck,HOF
2075, females get beat by a nigga amp go back fuck you see in him a rematch,HOF
2076, feinstein liar old bag should not be in the senate she is crooked chinese spying for,HOF
2077, fuck you bullies fuck you haters  love always wins,HOF
2078, stop lurking on my twitter bitch fuck you,HOF
2079, a psychological study found that people who are generally too nice are also the ones to get hurt the most,NOT
2080, you all better tell iggys culture vulture ass to unlike that video of foxy  we are not forget about her lil mess of a frees,HOF
2081,jesus did not scare the children he invited them  suffer the little children to come unto me r,NOT
2082, i have been a health visitor for years and i think video interactive guidance is an absolutely fantastic tool these p,NOT
2083, i do not need k12 i need k,NOT
2084,lmfao you are a loser,HOF
2085, two oil majors company she will and total declare force majeure on bonny light reuters said bonny light exports had bee,NOT
2086,  calls on house leadership to remove ilhan omar from the house foreign affairs committeei agree out of the abundanc,NOT
2087, if president trump designates the muslim brotherhood as a terrorist org it will be the biggest hit to the global islamist,NOT
2088, do not nobody want to see that shit,HOF
2089, thanksgiving when the people who want to force their ideas of progress and government on the inhabitants of the great pl,NOT
2090,i do give a fuck n i hate myself for that,HOF
2091,hehehe you are welcome,NOT
2092,me i smell weed  you are like a drug dog,HOF
2093,fuck le bah,HOF
2094, raise your hand if you think president trump nominating william barr for attorney general is now one of the best decisio,NOT
2095,because you are my fella my guy hand me your stella and fly,NOT
2096, everything you are going through right now is temporary hang in there things will get better,NOT
2097,his motive is to run against trump what moron,HOF
2098,do not get me wrong i understand there is on and off persona but i think those days should be gone instead you shoul,NOT
2099, who raised these hateful ass bitches,HOF
2100, worst part about online shopping is getting up to get my card ,NOT
2101, breakingvice president of the united states of america mike pence calls on democrats to remove embattled rep ilha,NOT
2102, if you are on a low income you might be able to get some help with paying your council tax find out if you can apply for coun,NOT
2103, i am in my you got to prove everything you say to me phase of my life,NOT
2104, i cannot tell if people are madder at the got finale or madder at rupaul for eliminating,HOF
2105, ty give me give me hand it to medy i will hold it ty just hand it over we are not going to places i wantdy i am,NOT
2106,why is this that the case why is america defending jewish racial supremacist colon,NOT
2107,as in  some people need deliverance,HOF
2108,you are adorable,NOT
2109,on godmen do not understand my humor you all are lame as fuck,HOF
2110,that really is a perfect ass just needs my hard one rubbing on it,HOF
2111, fuck fancams get this to million,HOF
2112, if hulk smoked shisha and rented whips on eid this is what he would look like,HOF
2113,the montlake bridge has reopened to traffic at 3101 pm,NOT
2114,see you all later byeeee fucking cancer cells,HOF
2115, ultramombecause i am sick and tired of no thicc ultra whamen,NOT
2116, after crying for minuets because you do not know where your life is going and you are fucking scared of the future,HOF
2117,do not cus then you are going to make me cry in the club ,NOT
2118,ken fucking gets it be like ken,HOF
2119, years ago cannot be tamed was released this song is everything and we all know that miley kicked disneys ass with,HOF
2120,she a fucking super hero what the hell this is one of my favorite videos ever,HOF
2121,any person in this thread criticizing the president for this is a big time asshole this is one th,HOF
2122, need a full day rest,NOT
2123, sexyasfuck why  because this is fucking sexy of course,HOF
2124, i fuck like i ensure i hold the bottom in the most dominant way i want them to feel my dick piercing their wal,HOF
2125, this liar and thief stolen valor he should be charged,HOF
2126, girls be having finstas with  followers bitch that is not a finsta that is a whole ass public service announcement,HOF
2127,i am going to go now,NOT
2128, with all the kindness i can muster i hope these two take this as an opportunity to confront what is clearly insecurity an,NOT
2129,today i found out trump retweeted a person with a sayori avi,NOT
2130, ariana grande fucking lit,HOF
2131, sir nicholas winton saved mostly jewish children from nazi occupied czechoslovakia on the eve of wwii through operatio,NOT
2132,me thinking harder and digging my hole ah is this what liu qingge feels,HOF
2133,of course it is hard you are doing it allyou need to get her full helpi know it is terrifying on,NOT
2134, do not bring your fucking antivaxxer bullshit to the west indies we have mandatory vaccination because we are not dumb a,HOF
2135,people followed me  automatically checked by,NOT
2136, they said fuck them kids,HOF
2137, the older i get the finer i get the more patience i have more ass amp more money this not bad at all,HOF
2138,do not miss out on attending destination bootcamp this day workshop can help you learn how to work on your b,NOT
2139,i need a liveatream,NOT
2140,if you fed orange chicken to a real panda it would probably die,NOT
2141, notifying the ancestors they about to fuck it up,HOF
2142, have you ever been through something you thought you would never make it through yet you lived to tell the story,NOT
2143, soyeon did not think she was good at dissing ppl but even tho that was a weak spot for her she wrote her disses in such a,NOT
2144,i only slept at am because i took a long ass nap yesterday now my eyes are painful af,HOF
2145,vm2 is fucking done,HOF
2146, you got a big ass mouth for a little ass boy,HOF
2147,i want to walk all over you smother your face with my massive black cheeksmind fuck your brain leave you locked i,HOF
2148, more people will die its that simple harris tried to do this and was stopped wrote a letter about road safety an,NOT
2149, anyways what we have learned tonight is that kpoppies suck balls it is immature to call people emo as in insult and go stan an,HOF
2150,i am screaming duck ass hoe,HOF
2151,get more info about landlordsgas,NOT
2152, going to be honest here they are just going to label you a weak bitch so work on being more assertive and taking up the space t,HOF
2153, stop what you are doing and watch this piece of skilllive clips,NOT
2154, i wish chris wallace would spit the marbles out of his mouth and quit mumbling like a damn idiot this never trump asswipe,HOF
2155, barr does not answer hirono question does he think it is ok for the president to tell his wh counsel to lie says not criminal,NOT
2156,meen know what you want me tell you inno,NOT
2157, excuse me is this what you are calling ugly,NOT
2158, video of a nazi getting egged bitch,HOF
2159, fuck and i cannot express this enough tyoup supporters amp those who voted for him,HOF
2160, they fucking won,HOF
2161, want to know why people like me because i am open to where i have been and i speak the truth want to know why people hate me,NOT
2162, la sold out wtf i could not get any wtf ,HOF
2163, abortion rights are not just about whether i can get one where i live you narrow fucking lemming,HOF
2164,i sholl was fixing to ssy damn sis big ole freak,NOT
2165, i was really expecting drogon to come back and fuck them all up but ok,HOF
2166,basic mathematics if you do the work and do it well people will want to work with you so its a bit awkward when,NOT
2167, for my baby cousin help kaya kick leukemias ass,HOF
2168, since hakyeon left nobody has been supervising taekwoons snack purchases hes locked himself in his room with soda and sn,NOT
2169,fine,NOT
2170,you are a good good father its who you are,NOT
2171, nat would have checked up on tony there is no way she would have forgotten him but the russos do not know the characters they are,NOT
2172, if you are in a bad spot mentally i hope you feel better soon,NOT
2173, this is a nice thread for game of thrones called what was the fucking point,HOF
2174,ignorant vulgar pig puppet for her subversive treasonous masters she does not belong in any po,HOF
2175, morning wood requires a morning but do not you think,NOT
2176,the white kid that threw a water balloon at me in rd grade is a domestic terrorist that tried to cowardly attack the maltese,HOF
2177,i think he will plead the fifth amendment because he is involved and he does not want to incriminate himsel,HOF
2178, scroll downkeep scrollingnow you are obligated to reply wi,NOT
2179, to people using the drama with jared as an opportunity to try and hit on heidi ew fucking stop that is super grody what,NOT
2180, i have got full prom outfits to give away to lgbtq blackpoc young people courtesy of from their asos design collec,NOT
2181, parallelsyou really can not make this shit up,HOF
2182,lol seei need to know ppl going to rouse myself,NOT
2183, a kid got killed at school yesterday but abortion is what people want to ban that is sick kendrick castillo die,NOT
2184,it probably will shame that such a great show was dethroned right at the end,NOT
2185,third time watching the series and i am noticing dumb shit lol,HOF
2186, iont miss nobody from my past fuck you,NOT
2187,does anyone else not think she was the worst dressed ,HOF
2188, if this is not in my future i do not want it,NOT
2189,shit i needed to hear that like how you think beau,HOF
2190, i want you to kiss me with a ticket to another world inside your mouthsee more of me,NOT
2191, once i get rid of these fucking lonjas ni me van a reconocer pendeja,HOF
