,text,task1
2505, when a thing is clearly modeled by a person who would never choose to wear the thing they are modeling,NOT
2506, fuck eating my pussy are you going to help take my braids out,HOF
2507,need to go get my passport shit sorted out soon europe is going to be lit,HOF
2508,you are doing amazing job kindu,NOT
2509, so you are going by cody ko now nerd haha what is up douche bag it is noel from highschool remember me me and the guys,HOF
2510, when you carry yourself at a high as standard it will make a bitch that carry they self like trash uncomfortable,HOF
2511,shit i want this,HOF
2512, damn this is sadrip russ,NOT
2513,what the fuck,HOF
2514, jared looks so proud while saying jensen fucking ackles,HOF
2515,you are going to find yourself in some lopsided games in your time on the court how do you handle getting blown ou,NOT
2516,one funny side effect of delivering threddy gifts to peoples office mailboxes is that i get to see,NOT
2517, is it so hard not to be racist like wtf retweet to show what kind of person she is,HOF
2518, lindsey graham just read from the strzokpage text messages trump is a fucking idiot on national television in fron,HOF
2519, me at years old bilingual genius iq mentally healthy able to do mathme now illiterate health is nonexistent and n,NOT
2520,i just hope you are well,NOT
2521, taehyung better stop acting the fuck up or i am booking him the next flight back to korea,HOF
2522, i am going to be straight if you are sad you are single and you want to find the one you will probably not find them by twee,NOT
2523,i do not have the words to describe this bitch and her ultra stupidity,HOF
2524, my ex would let me go to sleep crying next to him that is the shit i will never tolerate again,HOF
2525,damn but my switch,HOF
2526, one thing about me  ion kiss ass lmao fuck you,HOF
2527,weak mindedwhat makes remoaners such insufferable twatswas it not getting your own way,HOF
2528, sorry guys i do not fuck with my teeth or my eyes,HOF
2529,only fuck w this weather for da beanies,HOF
2530, mj had a taste of the chicken while bin is away and mj said he had to eat more so jinjin said that no we need to eat once,NOT
2531, when you and the squad go to mcdonalds and get a big mac,NOT
2532, to everybody out there who feels like you are not worth it and cannot get through to whatever is coming against you are,NOT
2533, we won mr stark we will be fine in here you can rest nowme,NOT
2534, i want you to know that i always think of you and pray for you to recover soonget well soon everyone here misses ur contag,NOT
2535, some say i lucked up i call that perfect timing i cannot lose the whole citys behind me i got to go to work,NOT
2536,i bet the coppers are well impressed having to protect that racist little shitsolidarity bootle,HOF
2537,shame shame shame on,NOT
2538, its too late for all that lovey dovey shit,HOF
2539, beyonc said have a life before being a wife and that is what the fuck we gon do,HOF
2540, got these reusable make up cotton pads only took one to remove full face of make up amp once you have used all you can just th,NOT
2541,traitor,HOF
2542,of course those are fine as well hes a creature who is accepting of all forms of affection,NOT
2543, are you the guy that completely supports the lying cheating conning pornstar rawdogging president sit down,NOT
2544, ok but who the fuck drew eyebrows on him lmaoooo,HOF
2545, i am doing my bit to help bereaved children by running the for my charity you can help b,NOT
2546, this cannot be said enough voters are not the fucking problem what did they have to vote for labor gave them nothing w,HOF
2547,i am so fucking useless at going to school i actually do not know how i have not been kicked out yet prolly because my grades fire,HOF
2548,ah okay i misunderstood that and thought that tweet was referencing trans,NOT
2549,way to go nina for calling out the fugazy tiffany lamp,NOT
2550, what about you all long ass convos before sex  time to fuck sojourner truth,HOF
2551, truly unbelievable ben shapiro is on bbcs politics live he believes most muslims are radical is a vile racist about arabs amp,NOT
2552,you are sifting through the treasures and trash of your inner w more for virgo,NOT
2553,rip stupid bird   ,NOT
2554, fuck you newt mute the newt you ethics violatin forced resignin practicin catholic w multiple marriages sinnin power abu,HOF
2555,i literally wait until the last minute to do everything its fucking disgusting at this point,HOF
2556,thanks you for this pic sir marknabuhay ulit ang yellow heart koi really miss this two so much,NOT
2557, girls remember that you can choose your husband but your kids cannot choose their father so choosing a good dad,NOT
2558, this is regional director jimin attending board meeting in ny and meeting the cute presenter graduate then fucking the nig,HOF
2559,my niece would get that ass beat and so would her punk ass bird,HOF
2560,literally never say to me you will be ready in a few minutes and then take almost three to actually start to get ready,NOT
2561, she is not going to like me putting this up i have taken agnes to a shit ton of festivals and see some of the biggest names in the sc,HOF
2562,okay taetards think that i support this shit lol idiots indeed feel free to go over my profile para hindi kayo as,HOF
2563, now low iq maxine wants to impeach barr who is next i think that is probably the largest word in her vocabulary,NOT
2564, the trump administration has thrown respect for science into the garbagewho would have thought our country would be taken o,NOT
2565, if another person getting your attention the fuck you need me for,HOF
2566,bob sierras dad not odenkirk man i need to get up jeez i am mr fucking horizontal over here,HOF
2567,little girl you know you do not have to expose barney like that bad girl gtc i am about to slap your ass with my purple tail,HOF
2568, might fuck around and tell my homies i love them,HOF
2569,this shit was wholesome,HOF
2570, i am at a place in my life where all you all can kiss my ass,HOF
2571,smart shit are not better,HOF
2572,they are simply very powerful baboom they go,NOT
2573,who wants to go message me so we can buy the tickets as soon as possible can go in my car i got the hotel,NOT
2574,that is ok the rest of the country does not trust you so we are even,NOT
2575,well you hurt cat too by getting her husband killed so fuck you petyr,HOF
2576,there is this scene where the protagonists father is teaching him to box and the father tells him about his own pe,NOT
2577,i am just looking at myself like can you see who you are asking mans deader than man us hopes and dreams,NOT
2578,that is definitely her ass cheeks,HOF
2579,adulting sucks i do not want to vote for any of these racist sexist homophobic assholes who think climate change is,HOF
2580,my ass is sore,HOF
2581,or just never do that like most people i do not think i ever actually checked my feed,NOT
2582, she left she probably looked anxious because she probably got a lot out in the open do not look into it too much htt,NOT
2583,blumenthal is a blooming idiot never understood a word he said,HOF
2584,unreleased emotewait fuck i am late to the leak it is been released,HOF
2585,shush you are going again,NOT
2586, the older you get the more you realize a 50k salary are not shit,HOF
2587, this shit pissed me off phoebe did not have no excuse like tf is goin on,HOF
2588,oye suns ur sick player did not know you edited too how ya been,NOT
2589, scroll downkeep scrollingnow you are obligated to retweet qu,NOT
2590,i do not know how mv shootings go but i have worked on plenty of movie sets before and i can say filming is long,NOT
2591,i am an adult but i am just  catch me enjoying my youth some of you too pressed to be grown that you are boring do,NOT
2592, just found out i have to piss and shit for the rest of my life,HOF
2593,this why the only wings i fuck with are fried,HOF
2594, go green not just by blood but also by heart,NOT
2595, my girlfriend damn kim and kanye are having another baby they should name it wildme wild whywild west,NOT
2596,nobody is hating on you bitch in fact nobody gives a damn about what you do or do not do,HOF
2597, not only is james charles racist transphobic and a predator but his screenshots are poorly photoshopped and still the t,HOF
2598,klay thompson just told me fuck off when he made that,HOF
2599, what women do when they want to fuck but they do not want to explicitly say it or initiate it,HOF
2600,fuck was she smokin,HOF
2601, go check out noels review of the same flight i was on poor noel was only two rows behind me but might as well have bee,NOT
2602, i can relate to this perv when a slut i am fucking tells me how many guys have already fucked his sloppy hole i get even h,HOF
2603,fuck you,HOF
2604,that mf is gone be trash lol,HOF
2605, dudes will disturb your peace ghost you then wonder why you are crazy lmao just when you thought you were about to finall,NOT
2606, totally fine to like burritos more than you like most people,NOT
2607, my ass is so damn cute,HOF
2608,yal ever had a ex you just wish you never talked too like bitch die,HOF
2609,hey there can you clarify the issue you are having if you contact us here with more info a,NOT
2610, lindsey graham the radical left can kiss my assthe radical left your head is in the way,HOF
2611, magnificent i am proud female veteran that voted for president trump if your a proud american,NOT
2612, taehyung shoved his cock in jungkooks throat and fucked it like an asshole,HOF
2613, this piece was about the power of either chamber of congress to censure a president but the same applies to an attorney gene,NOT
2614, why did not president obama do something about russia in september before november election when told by the fbi he,NOT
2615,capturing a quality selfie of my sweet round ass is so hard to do when these giant natural tits keep getting in the,HOF
2616, why does this dudes ass crack look like the default facebook profile pic,HOF
2617,very glad you are my president,NOT
2618, this bitch called tony wrinkly raisin so chris evans fought for our wrinkly stevetony rights,HOF
2619,shit is disgusting,HOF
2620, more of the water industrys dirty little secrets exposeddid you know that southern water apparently flooded the k,NOT
2621, become mentally untouchable never react only adapt do not take shit personal,NOT
2622, fuck this essay man,HOF
2623, you all better be mindful of who you all have around you all kids shit like this do not need to happen fr that shit there make m,HOF
2624, the women of this country are going to need to rise the fuck up and take care of this outpouring of misogyny in so many fo,HOF
2625, conservatives on abortion we want a banconservatives on gay marriage we want a banconservatives on immigration we w,HOF
2626,so jealous i will not be there until tomorrow but i glad you are having fun,NOT
2627,i do not think you would get a whole lota cash doing that and the probability of you getting caught is very high,NOT
2628,if you would like to pick up crumbs for the rest of your life then motherhood is definitely for you,NOT
2629,ty the ppl wholistened means everything me,NOT
2630, damn now i got to be an nba player to put steph in hand cuffs you niggas wild but its ok,HOF
2631, i do not give a fuck about you what i do give a fuck about us the size of your bank account,HOF
2632, riley grisar is the chapter president of the las vegas turning point usa his father is the vice president at aegis senior co,NOT
2633, our babys going to enlist soon and i do not think i am ever going to be ready to say goodbye,NOT
2634,i would have legit passed out what the fuck,HOF
2635,shawty do not play no games with me yeah that shit is lame to me,HOF
2636, we have all lost a good bond over some wack shit,HOF
2637, pouya dumb ass wildin bro wtf,HOF
2638,she lived to see it thought of him as a monster in public even,NOT
2639, taeils character development gt20192017 idk why they think i am cute  hello i am a cutie but the unchangin,NOT
2640,barr is not terrified hes fed up with their bull as most americans who know the truth are the left is out of control,NOT
2641,ditto even if it is just a little bit off not following i am getting really good at sorting this s,NOT
2642, ajax are two wins away from their wildest dreams coming true,NOT
2643,people followed me  automatically checked by,NOT
2644,glad i saw this post before i signed up for your product went with duolingo instead ,NOT
2645,its simple you old fool athletes get paid millions because fans buy gear tickets and concessions noone buys,NOT
2646, the mischief in his eyes you just know hes about to do something stupid i190429 who do i see,NOT
2647, zack stop you are going to get in trouble,NOT
2648,she has humanitarian helping causes around the world yeah right fucking monarchy useless people glad we do not have that shit,HOF
2649, just invented the sequel to the game fuck marry kill its called stan cancel mute,HOF
2650,legendary alm is colorless and uses a bow why are you fucking with me like this intsys,HOF
2651,welcome to london where life is a fucking joke and the goverment treats poor people like trash,HOF
2652,blah i would rather hear more about your ceos spending habits but from your pov not some publicly f,NOT
2653, telling me awww thanks after a compliment is  to saying boy gtf ugly ass ashy ass nigga,HOF
2654, this is hard to watch but we cannot look away this is who we are this is what we have donewhere do we go to from her,NOT
2655, karma where you at you you better have my back because you know damn well i did not deserve that oh i am fixing to lose it go,HOF
2656, i am not always able to maintain a balance and i think that is important for everyone to know about,NOT
2657,you look amazing but i want to see your pretty face and smile,NOT
2658,people followed me  automatically checked by,NOT
2659, hope you get better,NOT
2660,sometimes i smooch my kitty between her ears and then tell her you got kissed on the head i kissed you on your li,NOT
2661,might just fuck around and blow my head,HOF
2662, people will apologize and go back on their bullshit the next fucking day,HOF
2663, we are still the same boys from six years ago we still have the same dreams  kim namjoon the president,NOT
2664, lol fuck off,HOF
2665, you told us president trump was a traitor for over two yearshave a seat clown,HOF
2666, it is a little after pm here and this where the countrys th democratic election results stands in the lead with ,NOT
2667,i am kind of thickheaded so m sorry if i ever do anythin stupid please tell me if i do okay i um i want to be the best guy for you,NOT
2668, anyone that finds this funny is a lame ass bitch that is never been forced into an uncomfortable place for the sake of their,HOF
2669, if you are prolife but not pro comprehensive sex ed subsidized birth control health amp childcare foster amp adoption refor,NOT
2670,cops are fucking disgusting you cannot change my mind,HOF
2671, out of vlogs we got from gahyeon from jiu from yoohyeon and from siyeonwill we get one from  https,NOT
2672, look how weathered she looks amp i do not think i have ever seen her hands look so frail the trump administration in two short ye,NOT
2673, okay tae okay holy shit tae you all when i say i died,HOF
2674, id lick the sweat from her ass crack,HOF
2675,lmaooooo bitch i feel the same way about your ass,HOF
2676, breaking white house officials asked don mcgahn twice in the past month to publicly say trump did not obstruct justice this is,NOT
2677, i tried removing the bokeh effect on yedams profile images this is the best i could do whoever thought the effect,NOT
2678, i baru baca separuh and all i want to say is fuck him luckily you are not my boyfriend tak sayang blah je lah malukan g,HOF
2679,need to see this,NOT
2680,trust yourself you know more than you think you do,NOT
2681,i am so sorry i cannot stop myself from starrin at you when you are tired and blue my dear,NOT
2682, nobody seems sufficiently concerned that the billionaires are planning on leaving the planet with all our wealth and resou,NOT
2683, armylegends are we okay i think the fuck not,HOF
2684, snl i mean i think we didokay what do you all think   kingm namjoon,NOT
2685,i am so tired of following people from jail on fb shit is so annoying,HOF
2686, bitch its pouring and i do not want to be productive at all today,HOF
2687,i have been seeing so much rhcp hate on my tl what the fuck,HOF
2688,video little girl is moving out of the house because her father said she cannot have a boyfriend in his house,NOT
2689, jung fucking kook bts,HOF
2690,fake news is the main enemy of americalets tell these crooks you are fi,HOF
2691, how are we going to imprison women for getting abortions if we will not even give them maternity leave what the fuck,HOF
2692,so impressed so far by petes answers he is smart he is clear and he gets the message across,NOT
2693,approaching serious peka weather here in melbourne miserable as fuck picking up a new one tomorrow imported haha,HOF
2694, if we get an emotional vlive tonight i am going to eat my own fucking fist,HOF
2695,our offices have taken delivery of their mental health and wellbeing boards just in time for the start of mental,NOT
2696,i really got ass,HOF
2697, receiving a b in a class you were supposed to get an a in ltltltltltltltlt,NOT
2698, intimidation if you touch our base will come after youhe does not intend to show updefying the subpoena w,NOT
2699,i am weak a heeeeeeell,HOF
2700,if you ever come across people talking about me and saying things you know i am capable of please do not defend me,NOT
2701, how the fuck did she buy an audi with dollars,HOF
2702, just before go to sleep i want to see your wallpaper pictures of your phones  iam just curious to knowhere is mi,NOT
2703, no matter what faith or religion you are from we all have to make the world a better place rabbi yisroel goldstein ca,NOT
2704, this shit was sexy asf nigga was tryna tell home to go slow before he nutted but he did not listen,HOF
2705, spoilerswill that be all mr starkthat will be all ms pottshey pepsit is okay tony you can rest now,NOT
2706,let us fucking do this,HOF
2707, aang would probably put up a good fight deflect all the rasengans and rasenshurikens like a boss because they are attac,NOT
2708, retweet for more fuck fuck,HOF
2709, you are going to have haters and you are going to have lovers,NOT
2710,get your copy of dance mama dance now on itunes,NOT
2711,my lord she sighed as his lips moved to her neck you are far more dangerous than you look,NOT
2712,i am just so tired but i do not want to sleep,NOT
2713,he never suggested that he said they should but they will not because they are not the dems and we d,NOT
2714, did you all tried unwhitewashed wayv today i think unwhitewashed wayv is superior,NOT
2715,babies do not need to be around animals they too damn rough with them,HOF
2716,i fuck with you but do not get mad at people trying to seek opportunities when you never specified your tweet enough,HOF
2717,i got the dress amp it came wsleeves that i do not like so i might got to get on my arts n craft shit cuzzz lol,HOF
2718,i feel sick,NOT
2719,if you are in it then i do not want it let all else fade awayyyy,NOT
2720, avengers and bts hes stating facts,NOT
2721,cast me far away play these little games,NOT
2722,they are showing scrubs from the start on music this week is anyone else finding that it will not series record only,NOT
2723, barr states how did we get where the president was falsely accused of collusion and after all the rhetoric you would think,NOT
2724,just saw the sonic movie trailer what the fuck,HOF
2725, spoilershow did the look in his face in that last one literally bring tears to my eyes give rdj a fucking oscar htt,HOF
2726,i am not the one for the stupid shit,HOF
2727, sexual assault rate would go off the roof men are absolute animals and sharing such intimate space with them is a madness,HOF
2728, can we just agree at this point that everything this corrupt traitor does is shocking and inappropriate that everything he,HOF
2729, this movie is a fucking cinematic masterpiece of a fever dream,HOF
2730,get a clout house,NOT
2731, me  january is the trial month february will be the start of  i swear to start my shit seriously in february also,HOF
2732, varakashi are delusional the question of who the legitimate mdc president is was left to the electorate on july wher,NOT
2733,reading his thread had me thinkhe could just not rape herhe could receive formal consenthe could not fu,HOF
2734, how bad does trump have to get before he is forced from office,NOT
2735, how can you date a man that does not eat pussy saddest shit ever,HOF
2736, you are all praising gay joe russo when agent jimmy woo asked scott lang out for dinner with his entire chest,NOT
2737, why are people calling jontron a racist the guy apologized and it was like years ago it is not like he still believes what,NOT
2738, eijirou be my husband i want to spend the rest of my life with youand kirishima said yesfin,NOT
2739,queen sansa of the north bitch,HOF
2740, tati westbrook just grabbed the sexual predator and manipulator james charles by the neck and dragged him and his career st,HOF
2741,and in case you forgot you are a genuinely terrible person,HOF
2742,no need haha  insert selena gomez kill them with kindness,NOT
2743,yesssir owwwwe you know the fucking scouts,HOF
2744, boomnever threaten the united states againhey world the apology tour is over america is strong again and we will fi,HOF
2745,people followed me  automatically checked by,NOT
2746,you worried about the president he are not worried about you some man walking around on the sidewalk w a microphone amp speaker,HOF
2747, me at yearsold do not tell me what to dome at yearsold please tell me what to do,NOT
2748,lookin like a peanut butter reeses cup and i need a piece,NOT
2749,i loved that book amp a couple of the sequels but as far as julian is concerned i have zero fuck,HOF
2750,you all go get me some wings,NOT
2751, it is antisemitism and it is racism plain and simple,NOT
2752, do not tell nobody shit we do so i could keep fuckin you,HOF
2753, the fuck,HOF
2754,gama international past president chris noonan discusses how to fill the leadership void at,NOT
2755,i just found my bruh on jerry springer,NOT
2756,i cannot dance for shit but in my head i be fucking moving mane on god,HOF
2757, nah hes just instagram stupid,NOT
2758,totally not against sex before marriage i mean who does not want a test drive but be prep,NOT
2759,this shit is legendary,HOF
2760, i am one breakdown away from a boob job do not test me,HOF
2761, when you have found the one you want everyone in your life to meet her and get to know her please meet my one my wife eli,NOT
2762,you all did not know this humans fucking suck and she is fully aware of it,HOF
2763,there you go ,NOT
2764,shit,HOF
2765, surrogacy fool lol,NOT
2766,i am weak lmfaoooo,NOT
2767,go get it we will be ready for you,NOT
2768,big facts,NOT
2769,wijnaldum you are my guy but you need to come off,NOT
2770,how is the feu crowd there at araneta failed to go there as i am under the wearher now,NOT
2771, nobodyme damn what i was fixing to say,HOF
2772, i had a hot streak on the roulette and won a fuck load of money but then my luck turned and my 100k quickly turned into lik,NOT
2773,when a guy tells you he mostly just likes hanging out with you because of your body and does not really think you are a cool person ltltltltlt,NOT
2774, now that they are all gone who is ready to tweet about sports,NOT
2775, westrjbjp inc gjbjp inc mhbjp ss ncp inc goabjp inc,NOT
2776, on polling day news channels happily showing pm kedarnath yatra do not forget today pm is a candidate from varanasi,NOT
2777,at years old i have working years left and i know exactly where to go and,NOT
2778, americas ass for just hr more on retweet for chance at free tee,HOF
2779, news coming from local unit she has been sent to custody of days for a silly photoshop i hope i am wrong as no woma,NOT
2780, the report of the global commission on the calls for a future that puts people and the w,NOT
2781, turning point usas field director said i hate blacks  like fuck them alltheir spokeswoman said hitler would not have,HOF
2782, adele saying that she is the boss is a big mood,NOT
2783, ill show you a certain side of me as long as you appreciating it once you do not you cannot get that again,NOT
2784,stephone gilmore is trash,HOF
2785,you truly are a fking moron  simply clueless as to how tariffs work no wonder you los,HOF
2786, fuck bro i hate locking my car and forgetting my keys,HOF
2787,you are a dumbass,HOF
2788, their music is so good they need to cut the offensive shit out but soyeon does her thing w the music and i am,HOF
2789, the belami boys pretending they need to learn how to suck cock but we all know cocksucking is all they do,HOF
2790,orange who,NOT
2791,i put away my laundry,NOT
2792, i hate people that make a problem out of everything  fuck on,HOF
2793,fuck you to the person who said jimin has black hair,HOF
2794,dad has better legs than me and it is quite upsetting,NOT
2795,i need one,NOT
2796, i have done more for firefighters than this dues sucking union will ever do and i get paid zero,HOF
2797, scroll downkeep scrollingnow you are obligated to rep,NOT
2798, if you are even passingly familiar with how trumprussia bombshell news cycles have worked for the past three years you would kn,NOT
2799,lakers fans outside staples are making us all look stupid our front office is not even in that bad of shape espn ju,HOF
2800,days left of the semester shit is kicking my ass,HOF
2801, hiii can i get a promo i am katy and ill probably follow you back if you have an about i lov making mutualsfriends https,NOT
2802,i can help you if you want,NOT
2803,that is australias ass,HOF
2804,tfw i need two mlb water katana from this event but earth grid sucks,NOT
