,text,task1
942, get your tote bag at today stop by your local store and buy a tote for 3 all proceeds go to s,NOT
943,and if you find a filipina and she is fine you better keep her cuz there are not nothing like a filipina girl,HOF
944, all you need to know about lindsey graham is that in he said trump was crazy and a kook who was not fit to be pre,NOT
945,living in barns n shit,HOF
946,die partner suck well that is one way to go,HOF
947,should the jewish americans side with the nazis w ar15s or the left  did they just ask that ,NOT
948,all i said hes had a lot of help when people say he did not and i showed you all all the numb,NOT
949,hes an attorney ffs and does not know what suggest means,NOT
950,bishop richard mr clean white  i am glad i do not look like what i have been through feat myron williams,NOT
951,you are going to need itshes going to need asylum in america what a dumb fucking comment,HOF
952, kyungsoo someday i want to do music that i want to do because i also like singing i do not know when it will be but i th,NOT
953, taehyungs ass i cannot breatheierjdj,HOF
954,will probably go to united the traitor,NOT
955, armys always apologizing for shit they did not do lmao,HOF
956,yessss they were running our government,NOT
957, i be depressed and horny idk if i want to fuck or die,HOF
958, what the fuck do you all be talking about on this app,HOF
959,me man was the rainiest year ever especially on the weekends at least it cannot get any worse  here,NOT
960,you know you fat when you walk like yo ass stank,HOF
961,so fine,NOT
962, i cannot believe for the first years of my life i did not know cows had to be pregnant to produce milk fuck dairy f,HOF
963, do not need no hateration holleration in this danceree,NOT
964, this jacket is legendary sick i did not get mines when i had the chance,HOF
965, i was when is took me i was sold to eight men but only three raped me the others used me as a slavein islamic st,HOF
966, i bet you are not doing what you are supposed to be doing right now,NOT
967, is where you are from a factor in where you are going tonight pm,NOT
968, men are sick like actually sick,HOF
969,bitches be pressed as fuuuuuck you do not like my content stay the fuck off my shit dyke asses,HOF
970, all you need to know about lindsey graham is in this short video clip below where he winks and smiles before restarting the ba,NOT
971, id be marrying him because he loved me and completes me not because of where he would get my ring from how horrible woul,NOT
972, mbbs really said fuck kihyun we want the spoon pen,HOF
973,i look at everything,NOT
974,fuck yea,HOF
975,nuest started from the bottom now were number two,NOT
976,look i am never shutting up about this,NOT
977, you were supposed to double text me idiot,NOT
978, in a dimly lit cellarmy son today is career day at my school but i did not tell my dad because i think his job is boring co,NOT
979,damn why you got to leak her nudes like that,NOT
980,i wanted to post an ass pic but i thought about this too,HOF
981,sick progress,HOF
982, karma is real  if you think you could get away with the evil things you do amp live a happy life you are missing it period ,NOT
983, remainers please do not boycott  instead vote for a remain party just put your tribal instincts aside and vote for a go,NOT
984, so you are only hearing from former fbidoj officials thanks for confirming your sources are the corrupt ones who all got,NOT
985,this needs to change we need to do better we need to show survivors that they matter and predators that their act,NOT
986,and now i kind of want a job making data visualizations for pornhub insights,HOF
987, me to endgame steve fuck you me to every other steve you are my ride or die you are my home skillet biscot you know w,HOF
988,  fuck dem kids2 fuck conservatives3 if i want birth control because i want to be rawdogged in the back of an applebee,HOF
989,further proof that any organised religion is fullon bullshit,HOF
990,my sister has birthday today it would mean everything to her if you wished her a happ,NOT
991, oh glory days the are triggered could not happen to better bunch of morons people are sick of being told we are racist ,HOF
992, thor needs to knock that clown winker on his ass tomorrow,HOF
993, there will never be another  all you young spittaz tryna copy his style are fake fucking frauds shit versions,HOF
994, labours reckless plan would hand benefit payments to the rich and cut support to those that need it most it would a,NOT
995, good morning everyonefollowing one of the worst days of my life i just want to formally apologise for the outrage i caused,NOT
996,this what you get for tryna get kfc as if popeyes is not superior,NOT
997,earphones ko,NOT
998, i think people need to realize that not all art is for everyone people who find s i,NOT
999,i am tired as fuck and man physically are not shit i am mentally drained i am fucking done bruh,HOF
1000,not my president,NOT
1001,bitch its going to melt,HOF
1002, what a horrible fucking finale it should be a crime for what these show runners did to this story,HOF
1003, face of may vote by retweetingto register for face of juneget started here  then pay,NOT
1004,so fuckin what i am a whole ass human and should have every right to yank that bitch out without going to jail,HOF
1005,you know how thor has a torn halfcape in ragnarok loki would tearcut his cape as he,NOT
1006, retweet obama slips up and admits he was an illegitimate and unconstitutional foreign president bo,HOF
1007,wiping tears from my eyesfuck steph and kd,HOF
1008,americas ass never fails us,HOF
1009, today marks the last day i gave a fuck,HOF
1010, reporter asks let us just say a snake bit your mom in the chest area would you suck the venom out to win the t,NOT
1011, tell cersei i want her to know it was me,NOT
1012, kamala harris this attorney general lacks all credibility and has i think compromised the american publics ability t,NOT
1013,bit duas performing with blackpink whatrttfffccshsh,NOT
1014,what a fucking stupid article,HOF
1015,a cheap suit like you schiff should be able to prove your claim but you are just a cheap suit with a big mouth,HOF
1016, your friend that is not my friend should never know my business,NOT
1017,these suck fuck,HOF
1018,ah you are better than this love,NOT
1019,ashlea is singing the wii theme tune but it took me a solid seconds to work out that is what it was bc she is that shite xx,NOT
1020,i just submitted my last final paper i am fucking free bitches,HOF
1021, i thought i am the only one who thought that this little boy looks alike ppeck but then i clicked this hanstag,NOT
1022,  who do you want to collaborate with rm rm come on shut up  bts  ht,NOT
1023, hours on a minibus what the fuck are we thinking,HOF
1024, if you are meditating in a cave keep your cameras away mate,NOT
1025, when a guy picks up ur chin to kiss you like yess that is what i like you go you get it,NOT
1026, on the road again sing it with me were on our way to gigi amp gpawls to help them and to celebrate mothers day,NOT
1027,48am dude yo shit was boomin boomin,HOF
1028,a mothers work is never donea mothers earthly work may never be done but her heavenly work is eternal,NOT
1029,i fucking love the new filter on snapchat that guys post looking like a bad bitch,HOF
1030, creme brulee or brown sugar milk tea or what so called trendy drinks like this are just basically sweet cendol with harga ya,NOT
1031,really proud of you i will never get tired to tell you this,NOT
1032, m so fucking mad they just gave them the price on the red carpet like bitch what you on someone hold me because if someth,HOF
1033, see what i found on my curious cat o is this a joke or what now,NOT
1034, the moots who follow james charles you have hours before i cut yo ass off so get to unfollowing or else,HOF
1035, can you fucking chill it was not him,HOF
1036, down down baby we going ko ko bop exo,NOT
1037, it fucking begins they are not testing all women just the ones who do not look feminine enoughkenya drops two sp,HOF
1038, you do not look filipino what am i supposed to look like adobo pancit lumpia kili kili or what,NOT
1039,i just want to die lol too tired to still live and breathe,NOT
1040,t having fun with food and restaurant planning in english today were all hungry now a big well done to jack,NOT
1041,lol you will probably never place one again unless your in urology,NOT
1042,alina did too but you do not see me yapping cuz she is actually talented oopsie if yo,HOF
1043,sometimes i think are there any people who see my arts and just oh no is that the one that does those shitty seafire stuff,NOT
1044, our economy and jobs market is booming the best in the world and in our countrys history  and we have just started,NOT
1045, you ever cry again its gone be in a rolls royce  lordtttt i need that type of energy lol just someone who does not w,NOT
1046,people followed me  automatically checked by,NOT
1047, the way he has his eyes closed while waiting for the hat to be put on him and his little smile after him is baby https,NOT
1048,so spineless a strong wind would blow him away,HOF
1049, not a single arab has ever shot up a school this is not only racist its stupid every school shooter looked like your alla,HOF
1050,sick and if his mother felt this way he would not be here would heso pathetic excuses are ju,HOF
1051,oh now i get it when the little bitch man is trying to dox young teenage girls hes a tough guy but someone his own,HOF
1052, who the fuck is everyone,HOF
1053, you are very foolish for that question mark,NOT
1054,gt10 free tix leftlisten up startups why you need a board and how to build onejoin us june bring your que,NOT
1055,and trump was not on camera saying he grabs women and they all want to sleep with him he,NOT
1056, being this comfortable and getting cheated on is what will fuck someone up beyond belief,HOF
1057, you all do not give a shit i do not either fuck you all,HOF
1058, a rivet instead of a lock stops all pathetic begging for release,NOT
1059,damn rob you need to go back to school,HOF
1060, is this real  what the fuck omg,HOF
1061, i am proud to be a gay son of god this valedictorian came out during his graduation speech at mormon university byu h,NOT
1062, have you ever just randomly cried because you have been holding shit in for too long,HOF
1063,fucking kill me,HOF
1064, me at yo bilingual cute smart quiet mentally healthy able to do math with my fingersme at yo illiterate ugly,NOT
1065, morning americamy awesome patriots rock amproll for godusajusticelove president trumpicebluemilitary never ha,NOT
1066, hey you need to cut ties with this entire family all brands that sponsor janelle need to stop do you see what y,NOT
1067, kylian mbapp at  x world cup x u19 euros x ligue  x coupe de la ligue x coupe de france x trophe de,NOT
1068, if you not my man i promise i do not give a fuck about you and i mean this in the most disrespectful way possible,HOF
1069, do you want to see our total votes accumulated for todayto unlock rts repliesin just hour,NOT
1070,ah shit mtvs running a little late,HOF
1071,huh it a fucked up black hole to get sucked into should they go,HOF
1072,the xplus cm series yuji sakai godzilla ric sold out at the yous store a couple of days ago now it is sold,NOT
1073,the entire shit show went exactly like i thought it would so i am holding up just fine however my ange,HOF
1074, i might not fuck w you but i do not wish bad upon you were all grinding trying out new paths no hard feelings,HOF
1075, they could easily have said bucky peggy i am with you but they chose to fucking put i love you i love my bisexual ico,HOF
1076,this reminds me of how dictators in third world countries work huh guess that is america now,NOT
1077,but for jack no one else could rein him in the way jack could could cut through his bullshit and brav,HOF
1078, well this is a heck of a piece of writing i will be pointing people to it and quoting from it for a long time to come,NOT
1079, me getting my iud hurt like a bitch but it felt like my only safe option a man who has never ever not even once had his,NOT
1080,zach pronschinske gets a pair of strikeouts to end the bottom of the eighth as uwwhitewater strands runners at fir,NOT
1081,people followed me  automatically checked by,NOT
1082,fucking hell man,HOF
1083, not deion ass,HOF
1084, what the actual fuck is happening in the yous,HOF
1085,get it on,NOT
1086, remember when the post got all over eric holder for stonewalling congress being found in contempt and for declaring himself,NOT
1087, bees really out here throwing ass now,HOF
1088,short answer you need to go away,HOF
1089, cristiano ronaldo 12 the most complete player ever,NOT
1090, what is the move tonightstfu you are failing two classes go study,NOT
1091, i have a small scrape on my hand which i covered with a bandaid because it is uggo,NOT
1092,i think she is mad you did not know her name,NOT
1093,you are so welcome,NOT
1094,wow such the smartass you are huh pedophile,HOF
1095, shit i am fucked now,HOF
1096, id be one fine ass hoe out in these streets,HOF
1097, such cuties holy shit,HOF
1098, call me ishmael seriously dude it is important call me as soon as you get this text we are going to go fucking get moby dick d,HOF
1099,so now jon going beyond the wall to live as a wildling fr what the fuck was this shit,HOF
1100,boy stop fuck yo yourself and go drink a stag carib trash,HOF
1101, rep ilhan omar says america is not going to be the country of white peoplenobody said it wasbut i can tell you,NOT
1102, is teaching me the importance of group energy there is some shit that is possible to do by yourself that people you t,HOF
1103, if you are not industry i do not fuck with you,HOF
1104,ok true fuck seungri but music wise i kind of liked them ohhh hyukoh is pretty nice too,HOF
1105,i dropped my headphones in my apple juice fuck this fate,HOF
1106, i have been putting out albums for a quarter century if you are just discovering my music now you may not know where to sta,NOT
1107,fuck sports what is up wit the money though,HOF
1108,my hoes always playin wen its crunch time dawg smh these bitches better be the same way wen its time for me too go to the zoo n shit,HOF
1109,the amount it costs to adopt someone is literal proof that the government does not give a single fuck about poor pe,HOF
1110, taegi is there something you fucking need,HOF
1111, she deserved a fucking movie before captain marvel i said what i said,HOF
1112,an acting ass actor dinklage,HOF
1113,lol what the fuck is this shakespears sister performance on graham norton,HOF
1114,what the fuck,HOF
1115, if people want to hate me i cannot stop them but it is not going to stop me from doing my job you want to know why bec,NOT
1116, we have all known from the day barr opened his lying mouth to congress he was only interested in covering trumps crooked ass,HOF
1117, still cannot get over this picture siszamo they are honestly no words to describe the level of admiration i have,NOT
1118,do you even know what sober is fuck off,HOF
1119,whoever forgot to tell putin about that carpet better not go near open windows in tall buildings this weekend,NOT
1120,fuck your book,HOF
1121, she going to die from taking this big ass dick,HOF
1122,if antivaxxers want to fucking die because they do not believe in medicine its ok go ahead they should get ext,HOF
1123, oh my fecking goddid i just hear scott hypocrite say we have to have respect for old peoplehow fucking dare heaf,HOF
1124,at work until tomorrow morning imessage games welcome,NOT
1125, please you all i work to fuckin hard for my shit,HOF
1126,no shit defending slavers is pathetic,HOF
1127,can never be me but you,NOT
1128,this shit needs to stop broooooooooooooooooooooo,HOF
1129,coming close to followers and i am thinking of doing a giveaway,NOT
1130,but i mixed the shit with water and the substance and both sides agreed with eachother some girl that had respect f,HOF
1131, i would rather die of thirst then drink a fucking root beer,HOF
1132, holy fucking shit i forgot i changed my sisters contact and tge sheer terror that filled my bones when i recieved this t,HOF
1133, here is corbyns adviser andrew murray father of labours head of complaints defending the murderous tyrant stalins,HOF
1134, need sum nasty ass sex like this,HOF
1135,i am about to tell her bitch watch yo mouth do not be sorry be careful bitch that is my nigga pill cosby,HOF
1136, i do not kiss ass but i do apologize in situations that were my fault,HOF
1137,will the raptors show up and help kawhi defend home court or is milwaukee going to go up 0,NOT
1138, untuk kali ke berapa ntah  aku harap sangatclear skin before rayaclear skin before rayaclear skin before rayaclear skin,NOT
1139, if you are a slut for iced coffee and saving the environment like me starbucks is selling a reusable color changing cu,HOF
1140, sometimes i get mad at myself bc i was really close to certain people that id never ever want to be friends w again i se,NOT
1141, its mental health awareness month amp i do not think i have ever been less mentally healthy,NOT
1142, my future mother inlaw what will you cook for my sonme,NOT
1143,fucking deceased,NOT
1144,i am definitely not gon be doin this shit long,HOF
1145,you are a bright and shining star,NOT
1146, if you had one of these growing up you are a guaranteed bad bitch now,HOF
1147,fuck me please let me suck that cock dry and clean,HOF
1148,off the rack ass,HOF
1149,its just nice to have a big fucking wall with an armed organization to guard it yknow for old times sake,HOF
1150,that is okay it is obvious you are a trump hater and you rather do that,NOT
1151,she so damn beautiful,NOT
1152,what the actual fuck,HOF
1153, fuck steph curry,HOF
1154,tune in today everything soulofthestreets35pm est,NOT
1155,portos bakery is coming to northridge and we know where its planning to open,NOT
1156, i think it is our responsibility to tell everyone about our pm where doing meditation excellent details about the mod,NOT
1157,i have two holes for a fucking reason,HOF
1158,still a bad bitch,HOF
1159,attorney general barr cancels second day of testimony escalating battle with congress  reuters  crooked ass,HOF
1160,it is may  at 00pm,NOT
1161, a haiku by seunghyubmy legs are so longlook at my good proportionsfuck all short people,HOF
1162, i cannot tell if that is a fucking crackhead or a hipster my mom driving downtown,HOF
1163, when you play the game of thrones you win or you diethe series finale premieres tonight at pm on ,NOT
1164,they are after me,NOT
1165, me i should go to bed early tonight me at am,NOT
1166, through regional office of hrc in bangkok they agree to have a better preparation and timing to the visit,NOT
1167,no offense but we literally bought a revolutionary war to not give a fuck about an unelected monarch,HOF
1168,that is fucking creative tbf,HOF
1169, do not ask me how i feel about it i do not give a fuck,HOF
1170, dad you are embarrassing me in front of my friends is it hot in here or did you just get burned oh sorry how insen,NOT
1171, he took my virginity and left me for his sister trash,HOF
1172,rudy you are either a lunatic or senile,HOF
1173, it was trump who cheated on his wifeafter she,HOF
1174, baby future when he wanted a big wheel but dad handed him a rolex instead,NOT
1175,i do not fuck wit like that no mo but i never turn down a good turn up me and my turks hating from outside th,HOF
1176,trash,HOF
1177, bill barrs inability to answer s question about whether the president or anyone in the white house su,HOF
1178,bruh i thought i was the only one who noticed his ass be saying a whole lot of nothing,HOF
1179, plot twist loki is actually alive and hes n00bmaster69 on fortnite that calls korg a dickhead for shits and giggles,HOF
1180,are you tired little guy,NOT
1181,i really thought with my whole ass chest that bran would show jon a flashback of rhaegar at the trident or something,HOF
1182, people are always like ur so brave for being so open about your mental illness and i always want to be like oh that is ac,NOT
1183, love her would love to fuck her on camera,HOF
1184, i found youi found you too181014,NOT
1185,you are welcome,HOF
1186, when the relationship dead but yaw keep fucking,HOF
1187,ah i get itsnp supporters abused you,HOF
1188, i have made the fucking discovery that when i said you saved my life to felix he replied you saved mine,HOF
1189,those invaders you stupid little racist child do a lot of the agricultural and construction work th,HOF
1190, shout out to the adult on the porch who watched this entire scenario unfold and just fucking sat there,HOF
1191, one day bts will be so tired of collab question that jungkook willl straight away say that he wants to collaborate with floy,NOT
1192, namjoon is one of the most incredible human beings ill ever have the pleasure of knowing i could never explain how hes hel,NOT
1193, i would die for keanu reeves i think,NOT
1194, this chi shit,HOF
1195, someone tell me why tf i put myself in these situations why cannot i just be a heartless bitch and not give a fuck geez,HOF
1196, i know you all are not hip to these cute ass sandals i just found at old navy and for the price you all,HOF
1197,it is monday i am not in the mood for you all bad ass breath,HOF
1198,i have never worked on my birthday nor gone to school,NOT
1199,ok you are such a bigger john mayer than i am wow good job,NOT
1200, how to suck his dick,HOF
1201,omg they are live,NOT
1202,its really crazy how some of you all will have a person that is such a blessing too you but you still fuck them ove,HOF
1203, get fucking vice,HOF
1204, if you give up nothing will eve get better in our country or our world  senator jennifer mcclellen,NOT
1205, thank you  lindsey graham saying trump is a fucking idiot on loop,HOF
1206,i can die in peace now,NOT
1207,its sick,HOF
1208,kind of want to go to the hot rub kind of want to smoke amd go to bed,NOT
1209, days to go see you there,NOT
1210, trump fits in nowhere he is too stupid for business tycoons to crass for hollywood too ignorant for democrati,HOF
1211, pete buttigieg is a christian because he has chosen to follow jesus full stophe does not need your permission doesn,NOT
1212,you are the rolling to my thunder keep being you,NOT
1213,i can only imagine how fucking stressfull it can be to get continuously bombared about shit on the pl,HOF
1214, fuck them niggas for life the way they did me wrong,HOF
1215,i think i am about to do fine on my final but i got to find a way to cheat  just in case,NOT
1216, harris just did some of that prosecutor shit,HOF
1217,up next ohio outlaws fucking,HOF
1218,holy fuckin shit iam so hppy,NOT
1219, i really hope nobody gets hurt over this mozzy  philthy rich beef but at least there is some hard ass records coming out as a r,HOF
1220, jon snow heart broken as fuck,HOF
1221,are not shit to do but think,HOF
1222,i like to think so,NOT
1223, i hope someday my future husband would not mind to spend some money for me to be this pretty after giving birth to his kids,NOT
1224, maybe we should start calling loki loki friggason because at least she is a mom to lokihis biological dad left him to,NOT
1225, ah shit here we go again,HOF
1226, in relationships you are never going to agree  with the other person respect each other and keep the peace because,NOT
1227,you are welcome,NOT
1228, watch my fuck a fan video gt playing on my private snapchat,HOF
1229,shit it might go games but they damn sure are not going out like that,HOF
1230,i do not know who need to hear this but cream is not white,NOT
1231,when memphis has the number one recruiting class and everyone wants to come out of the woodwork to tell us how big,NOT
1232,brie looks like a father of two,NOT
1233, i need this help me,NOT
1234, delusional it is unbelievable how many stupid people are out there living,NOT
1235,one thing about me none of my friends can say i fucked someone they talk to went with or fuck bitches snakes i,HOF
1236,well when you got to go you got to go,NOT
1237,i do not know where i am going but i have got to go,NOT
1238,if i cannot pick you up i cannot fuck with you,HOF
1239,i am a professional web and graphic designer do you need any kinds of business card portfolio,NOT
1240, minus the baby and i am with all the dumb shit,HOF
1241, i do not think my tummy has ever been like this  even when i was a fetus,NOT
1242,if nicki would have ever,NOT
1243, rt if you would fuck genie bouchard on her yacht,HOF
1244, not a damn day passes where i do not think about this,HOF
1245,it is length is certainly a draw which helps if you need to reread it to verify how good it is,NOT
1246,my neighbors are blaring eye of the tiger and i cannot help but think something is about to go down,NOT
1247, in videoill eat this welldeliciouslyill cut a bit of thisi was just cutting some of this a bit hard,NOT
1248, have you ever felt like you do not know what is going on anymore like you do not feel anything and you have lost your motiva,NOT
1249,i think you are younger then me,NOT
1250,you are like the unofficial mr xavier twitter edition you are hilarious as hell bro,NOT
1251,ahha you are my accountant now lowkey,NOT
1252,running on no sleep and just did my makeup in a public bathroom here we go,NOT
1253, he not the only one that can put two balls in his mouth,NOT
1254, you do not need lube when you fuck a gangbang whore his hole is wet sloppy and smooth as butter it will make your dick extr,HOF
1255,this damn iphone acting tf up,HOF
1256,why cheat when you can be single and do not have to worry about a bitch all in yo mix ,HOF
1257, nobodyme after my bitch get out the shower,HOF
1258, taemin throwing his pancake ass,HOF
1259,i cannot even calculate the damage this man will do to this country and the entire world before we get him out of office,NOT
1260,my dummy sick ass just got sent home early from work lol,HOF
